{
  "ai_off": false,
  "canonical_branch_id": "brn_01M1E62D76VQK80N1GBXECQKYQ",
  "created_at": "2026-09-01T12:00:00Z",
  "id": "proj_01M1E62D76FNNBXXTGBQRJKN0D",
  "organization_id": "org_1",
  "owner_actor_id": "act_01M1E62D76BMKXW2Q4NM6BD84F",
  "schema_version": "1.0",
  "status": "active",
  "title": "Test Feature"
}
